C2: How the | D2: Singularity | E2: will look | F2: like | I2: Each cell can have different colors
A3: Writing is more of a stream of consciosuness deal
I4: free | M4: bring
K5: Banned | L5: together | M5: in | N5: space
A6: 1 | B6: Storm Time | C6: Excelis | E6: What data in a matrix can represent MAN | L6: we | M6: the
A7: big | B7: 1 | C7: 44 | D7: space | L7: will | M7: mind
A8: white | B8: =B7+1 -> 2 | C8: 66 | D8: people | F8: It is, after all, a 2D mensional space | L8: Instant Interactivity
A9: Like | B9: =B8+1 -> 3 | C9: 78 | L9: win
A10: LEGOS | B10: =B9+1 -> 4 | C10: 99 | G10: Lonley | J10: NO JAVASCRIPT necessary
B11: =B10+1 -> 5 | C11: 98 | G11: Excel
B12: =B11+1 -> 6 | C12: 98 | G12: not | H12: Why couldn't words be placed all over the place
B13: =B12+1 -> 7 | C13: 99 | G13: just | H13: for | I13: accountaints | L13: discrete versus continuous
A14: Mind | B14: =B13+1 -> 8 | C14: 78 | G14: Worth playing with, right? | K14: like that | L14: block game
A15: all | B15: =B14+1 -> 9 | C15: 66 | K15: ALL SO META
A16: over | B16: =B15+1 -> 10 | C16: 44 | E16: Happiness Metrics | J16: Color overwhelmes
A17: place | B17: =B16+1 -> 11 | C17: 33 | E17: 23 | F17: 43 | G17: 24 | H17: 44 | I17: 69 | J17: is fun | L17: It's more of an art of the discrete
A18: This | B18: =B17+1 -> 12 | C18: WAR | D18: inside | E18: a | F18: rage | G18: fist
A19: is | B19: =B18+1 -> 13 | C19: 22 | G19: There are other elements, lines, bold tags, etc..
A20: such | B20: =B19+1 -> 14 | C20: 34 | E20: Nature of this | J20: Poetry 4 | N20: Diallo
A21: a | B21: =B20+1 -> 15 | C21: 32 | E21: will be just | G21: I mean, you got | J21: the | K21: Varying column width
A22: good idea | B22: =B21+1 -> 16 | C22: 75 | E22: all squares | H22: all the basic elements | J22: future
B23: =B22+1 -> 17 | C23: 34 | E23: and some numbers | L23: Thank you | M23: philosexual
B24: =B23+1 -> 18 | C24: 22 | J24: magnetic poetry
B25: =B24+1 -> 19 | C25: 38 | D25: Meaning | G25: ee cumings to the max
B26: =B25+1 -> 20 | C26: 984 | D26: rejects
B27: =B26+1 -> 21 | C27: 3 | D27: everything | J27: got this is much better
A28: AQUA | B28: =B27+1 -> 22 | C28: 5 | E28: Art can be in any medium
B29: =B28+1 -> 23 | C29: 34 | E29: It's all about Identity, the medium is the art
G30: Reminds me of that Powerpoint artist in WIRED
B31: What | C31: happens | D31: after | E31: the | F31: storm | I31: or more like scrabble or whatever